{
  "id": "double-diamond",
  "name": "Double Diamond Process",
  "description": "Design thinking framework showing divergent and convergent phases from discovery to delivery",
  "canvas": "standard",
  
  "annotations": {
    "title": {
      "text": "Double Diamond Process"
    },
    "subtitle": {
      "text": "From discovery to validated solution"
    },
    "caption": {
      "text": "Diverge to explore possibilities, converge to make decisions"
    },
    "legend": [
      { "shape": "circle", "color": "primary.navy", "label": "Problem" },
      { "shape": "square", "color": "accent.green", "label": "Opportunity (POV)" },
      { "shape": "triangle", "color": "semantic.success", "label": "LPP" }
    ]
  },
  
  "shapes": [
    {
      "id": "diamond-left",
      "type": "polygon",
      "points": [
        { "col": 1, "row": 3.5 },
        { "col": 3.5, "row": 1.8 },
        { "col": 6, "row": 3.5 },
        { "col": 3.5, "row": 5.2 }
      ],
      "style": {
        "fill": "accent.greenPale",
        "stroke": "accent.green",
        "strokeWidth": "medium"
      }
    },
    {
      "id": "diamond-right",
      "type": "polygon",
      "points": [
        { "col": 6, "row": 3.5 },
        { "col": 8.5, "row": 1.8 },
        { "col": 11, "row": 3.5 },
        { "col": 8.5, "row": 5.2 }
      ],
      "style": {
        "fill": "accent.greenPale",
        "stroke": "accent.green",
        "strokeWidth": "medium"
      }
    },
    {
      "id": "divider-center",
      "type": "line",
      "points": [
        { "col": 6, "row": 1.3 },
        { "col": 6, "row": 5.7 }
      ],
      "style": {
        "stroke": "border.default",
        "strokeWidth": "thin",
        "dashArray": "6,4"
      }
    }
  ],
  
  "nodes": [
    {
      "id": "problem-space-label",
      "type": "label",
      "label": "Problem Space",
      "textStyle": "captionEmphasis",
      "grid": { "col": 3, "row": 1, "colSpan": 2, "align": "center" }
    },
    {
      "id": "solution-space-label",
      "type": "label",
      "label": "Solution Space",
      "textStyle": "captionEmphasis",
      "grid": { "col": 8, "row": 1, "colSpan": 2, "align": "center" }
    },
    {
      "id": "discover",
      "type": "phase",
      "label": "DISCOVER",
      "grid": { "col": 2, "row": 3.5, "colSpan": 2 },
      "size": { "width": 100, "height": 32 }
    },
    {
      "id": "define",
      "type": "phase",
      "label": "DEFINE",
      "grid": { "col": 4.5, "row": 3.5, "colSpan": 2 },
      "size": { "width": 100, "height": 32 }
    },
    {
      "id": "develop",
      "type": "phase",
      "label": "DEVELOP",
      "grid": { "col": 7.5, "row": 3.5, "colSpan": 2 },
      "size": { "width": 100, "height": 32 }
    },
    {
      "id": "deliver",
      "type": "phase",
      "label": "DELIVER",
      "grid": { "col": 10, "row": 3.5, "colSpan": 2 },
      "size": { "width": 100, "height": 32 }
    },
    {
      "id": "start-marker",
      "type": "circle",
      "grid": { "col": 1, "row": 5.5 },
      "size": { "width": 16, "height": 16 },
      "style": { "fill": "primary.navy" }
    },
    {
      "id": "start-label",
      "type": "label",
      "label": "Problem",
      "textStyle": "smallMuted",
      "grid": { "col": 1, "row": 5.5, "offsetX": 24 }
    },
    {
      "id": "mid-marker",
      "type": "box",
      "grid": { "col": 6, "row": 5.5 },
      "size": { "width": 16, "height": 16 },
      "style": { "fill": "accent.green", "radius": "sm" }
    },
    {
      "id": "mid-label",
      "type": "label",
      "label": "Opportunity (POV)",
      "textStyle": "smallMuted",
      "grid": { "col": 6, "row": 5.5, "offsetX": 24 }
    },
    {
      "id": "end-marker",
      "type": "diamond",
      "grid": { "col": 11, "row": 5.5 },
      "size": { "width": 16, "height": 16 },
      "style": { "fill": "semantic.success" }
    },
    {
      "id": "end-label",
      "type": "label",
      "label": "LPP",
      "textStyle": "smallMuted",
      "grid": { "col": 11, "row": 5.5, "offsetX": 24 }
    }
  ],
  
  "edges": [],
  
  "metadata": {
    "category": "framework",
    "tags": ["design-thinking", "process", "discovery", "ideation", "diverge", "converge"],
    "source": "UK Design Council",
    "usage": "Introduce the design thinking process, explain divergent vs convergent thinking, frame the overall venture journey"
  }
}
